Keyword,Tracked,Campaigns,Min Monthly Volume,Max Monthly Volume,Relevancy,Monthly Volume,Search Intent,Difficulty,Last Updated
how much weight will i lose on a 3 day water fast?,FALSE,,11,50,0.44039612649992893,24,,,
how can i lose 20 pounds in a month?,FALSE,,11,50,0.44039612649992893,24,informational,60,2024-07-17
what should i eat before bed to lose weight?,FALSE,,11,50,0.44039612649992893,24,informational,44,2024-07-17
what is the easiest way to lose weight?,FALSE,,11,50,0.44039612649992893,24,,,
how much weight do i need to lose?,FALSE,,11,50,0.44039612649992893,24,informational,52,2024-07-15
what is the best food to eat at night for weight loss?,FALSE,,11,50,0.44039612649992893,24,informational,47,2024-07-15
how do i suppress my appetite?,FALSE,,11,50,0.44039612649992893,24,informational,57,2024-07-05
how can i force myself to lose weight?,FALSE,,11,50,0.44039612649992893,23,,,
how to start weight loss at home,FALSE,,11,50,0.47624209473192985,17,informational,69,2024-04-16
starting a weight loss journey,FALSE,,11,50,0.4658043983430341,17,,,
how can i lose 15 pounds quickly?,FALSE,,11,50,0.44039612649992893,17,informational,41,2024-06-22
what is a unhealthy weight loss?,FALSE,,11,50,0.44039612649992893,17,informational,48,2024-07-06
how to lose weight fast without exercise or diet,FALSE,,11,50,0.5733803406139517,16,informational,49,2024-08-10
how to lose weight with diet only,FALSE,,11,50,0.5596094014809199,15,informational,59,2024-07-05
how can i lose my stomach fat?,FALSE,,11,50,0.44039612649992893,15,,,
what is the best diet for rapid weight loss?,FALSE,,11,50,0.4495369891274706,12,informational,71,2024-07-24
lose weight naturally and fast,FALSE,,,10,0.4941208870222576,11,,,
starting a weight loss youtube channel,FALSE,,,10,0.4657733956782222,11,,,
how can i lose weight fast in a month?,FALSE,,,10,0.4495369891274706,11,informational,67,2024-07-17
what is the healthiest way to lose weight?,FALSE,,,10,0.4495369891274706,11,informational,74,2024-07-31
how can i lose 30 pounds quickly?,FALSE,,,10,0.4495369891274706,11,informational,49,2024-07-19
can you lose a pound a day?,FALSE,,,10,0.44039612649992893,11,informational,58,2023-10-24
how much weight can you lose on the 3 day military diet?,FALSE,,,10,0.44039612649992893,11,informational,60,2024-05-16
when should you worry about weight loss?,FALSE,,,10,0.44039612649992893,11,informational,58,2024-04-16
how do i maximize my weight loss on keto?,FALSE,,,10,0.44039612649992893,11,informational,48,2024-07-11
how can i lose 20 pounds in 30 days?,FALSE,,,10,0.44039612649992893,11,informational,63,2024-08-02
evidence based weight loss supplements,FALSE,,,10,0.5675004910213243,10,informational,68,2024-07-18
what is the best way to lose belly fat?,FALSE,,,10,0.4495369891274706,9,informational,70,2024-07-17
how do i get past a weight loss plateau?,FALSE,,,10,0.44039612649992893,8,informational,54,2023-10-24
how can i lose weight sitting at a desk all day?,FALSE,,,10,0.44039612649992893,7,,,
how to lose weight fast naturally without exercise,FALSE,,,10,0.5236615877864849,6,informational,45,2024-08-10
how do i begin to lose weight?,FALSE,,,10,0.4495369891274706,6,informational,68,2024-07-15
how can i lose weight drastically fast?,FALSE,,,10,0.44039612649992893,6,,,
extreme weight loss hannah,FALSE,,,10,0.5675004910213243,5,informational,56,2024-08-06
what is the most effective way to lose weight?,FALSE,,,10,0.4495369891274706,5,informational,75,2024-07-14
how can i lose weight in 2 days?,FALSE,,,10,0.4495369891274706,5,,,
how can i lose weight fast naturally?,FALSE,,,10,0.44039612649992893,5,,,
how to lose weight in 10 days by exercise,FALSE,,,10,0.5733803406139517,4,informational,58,2024-07-19
how to start weight loss when morbidly obese,FALSE,,,10,0.46549034847030735,4,informational,56,2024-04-16
is working out 30 minutes a day enough to lose weight?,FALSE,,,10,0.44039612649992893,4,informational,59,2024-08-04
how can i lose extreme weight fast?,FALSE,,,10,0.4495369891274706,3,informational,63,2024-07-17
is walking 10000 steps enough to lose weight?,FALSE,,,10,0.44039612649992893,3,,,
can you lose 10 pounds in 3 days?,FALSE,,,10,0.44039612649992893,3,informational,59,2024-07-05
what exercise burns the most fat?,FALSE,,,10,0.44039612649992893,3,informational,58,2024-08-09
how can i lose weight in 30 days?,FALSE,,,10,0.44039612649992893,3,informational,59,2024-04-16
how to lose weight fast naturally at home,FALSE,,,10,0.5236615877864849,2,informational,67,2024-07-19
how to start weight loss journey at home,FALSE,,,10,0.46579264437103723,2,informational,56,2024-04-16
getting started on weight loss,FALSE,,,10,0.4656955343604649,2,,,
how can i lose weight in 3 days?,FALSE,,,10,0.4495369891274706,2,informational,67,2024-07-19
how can i lose weight fast without exercise?,FALSE,,,10,0.4495369891274706,2,informational,52,2024-07-08
how can i lose weight in 10 days?,FALSE,,,10,0.4495369891274706,2,informational,60,2024-07-19
how can i lose weight in three days?,FALSE,,,10,0.4495369891274706,2,,,
how can i lose weight fast and cheap?,FALSE,,,10,0.4495369891274706,2,informational,61,2024-07-17
what should you eat when your trying to lose weight?,FALSE,,,10,0.4495369891274706,2,informational,64,2024-08-10
what is the fastest way for a kid to lose weight?,FALSE,,,10,0.4495369891274706,2,informational,57,2024-07-17
how can i lose 10 pounds in a week without exercise?,FALSE,,,10,0.4495369891274706,2,,,
how can i lose 10 pounds in 1 month?,FALSE,,,10,0.44039612649992893,2,informational,44,2024-04-16
can i lose weight in 3 days?,FALSE,,,10,0.44039612649992893,2,,,
which exercise is best for weight loss?,FALSE,,,10,0.44039612649992893,2,informational,63,2024-07-17
will walking 10000 steps help lose weight?,FALSE,,,10,0.44039612649992893,2,,,
what should i eat on an empty stomach to lose weight?,FALSE,,,10,0.44039612649992893,2,,,
how can i drop 20 pounds in a week?,FALSE,,,10,0.44039612649992893,2,,,
how can i speed up my fat loss?,FALSE,,,10,0.44039612649992893,2,,,
can doctors prescribe anything for weight loss?,FALSE,,,10,0.44039612649992893,2,informational,57,2024-07-17
how much weight can you lose in 6 months?,FALSE,,,10,0.44039612649992893,2,informational,45,2024-04-16
how can i drop 20 pounds fast?,FALSE,,,10,0.44039612649992893,2,,,
how do you break a weight loss plateau?,FALSE,,,10,0.44039612649992893,2,informational,48,2024-06-27
how much water weight do you lose before losing fat?,FALSE,,,10,0.44039612649992893,2,,,
what should a woman eat to lose weight?,FALSE,,,10,0.44039612649992893,2,commercial,70,2024-07-30
how to lose weight fast without exercise in hindi,FALSE,,,10,0.5998806334164185,1,informational,55,2024-07-18
extreme weight loss diets fast,FALSE,,,10,0.5675004910213243,1,informational,63,2024-07-31
how to lose weight fast for men in 2 weeks,FALSE,,,10,0.5584140405339542,1,informational,50,2024-08-06
lose weight naturally fast,FALSE,,,10,0.4941208870222576,1,,,
how to start a weight loss journal,FALSE,,,10,0.4658101675380384,1,informational,26,2024-04-16
how do i get serious about losing weight?,FALSE,,,10,0.45730140915326095,1,informational,69,2024-07-17
what are the 10 best exercises to lose weight?,FALSE,,,10,0.4495369891274706,1,informational,56,2024-08-09
will i lose weight if i stop eating?,FALSE,,,10,0.4495369891274706,1,,,
what is a safe weight loss per week?,FALSE,,,10,0.4495369891274706,1,informational,69,2024-04-16
how can i drop 10 pounds fast?,FALSE,,,10,0.4495369891274706,1,informational,57,2024-06-24
how can i lose weight when i have no money?,FALSE,,,10,0.4495369891274706,1,informational,47,2024-07-19
how can i lose 5 lbs quickly?,FALSE,,,10,0.4495369891274706,1,,,
how can i lose weight in 15 days at home?,FALSE,,,10,0.4495369891274706,1,informational,53,2024-07-05
how can i lose body fat quickly?,FALSE,,,10,0.4495369891274706,1,informational,61,2024-07-19
can you lose weight without exercise?,FALSE,,,10,0.4495369891274706,1,,,
how much weight can you lose by drinking water for 3 days?,FALSE,,,10,0.4495369891274706,1,informational,62,2024-07-17
which diet plan is the best?,FALSE,,,10,0.4495369891274706,1,commercial,71,2024-08-10
what should i eat to lose weight in 3 days?,FALSE,,,10,0.4495369891274706,1,,,
what is an unhealthy rate of weight loss?,FALSE,,,10,0.4495369891274706,1,informational,52,2024-07-17
which diet is the most effective in weight loss?,FALSE,,,10,0.4495369891274706,1,commercial,71,2024-08-01
what foods can speed up weight loss?,FALSE,,,10,0.4495369891274706,1,informational,61,2024-07-15
how can a girl lose weight fast?,FALSE,,,10,0.44039612649992893,1,informational,62,2024-07-13
how do i lose 20 pounds in a month?,FALSE,,,10,0.44039612649992893,1,,,
how do i get willpower to lose weight?,FALSE,,,10,0.44039612649992893,1,informational,50,2024-07-17
how can i reduce my tummy in 30 days?,FALSE,,,10,0.44039612649992893,1,informational,65,2024-08-03
how long will it take to lose 20 pounds?,FALSE,,,10,0.44039612649992893,1,informational,50,2024-07-20
what is the fastest way to lose weight?,FALSE,,,10,0.44039612649992893,1,,,
can i lose 10 pounds in a week?,FALSE,,,10,0.44039612649992893,1,,,
how much weight will i lose eating 800 calories a day?,FALSE,,,10,0.44039612649992893,1,informational,52,2024-07-20
how can i slim down in 10 days?,FALSE,,,10,0.44039612649992893,1,informational,59,2024-07-05
where do you lose weight from first?,FALSE,,,10,0.44039612649992893,1,informational,52,2024-06-27
how can i get fat in a week naturally?,FALSE,,,10,0.44039612649992893,1,,,
can i lose weight without exercise?,FALSE,,,10,0.44039612649992893,1,informational,52,2023-11-16
what really works for weight loss?,FALSE,,,10,0.44039612649992893,1,informational,70,2024-07-17
is it healthy to lose 10 pounds in a week?,FALSE,,,10,0.44039612649992893,1,,,
what exercise burns fat the fastest?,FALSE,,,10,0.44039612649992893,1,informational,51,2024-07-30
is it possible to lose 10 pounds in a week?,FALSE,,,10,0.44039612649992893,1,,,
can you lose 10 pounds in two weeks?,FALSE,,,10,0.44039612649992893,1,,,
how much weight can you lose by not eating?,FALSE,,,10,0.44039612649992893,1,,,
what is the best exercise for losing weight?,FALSE,,,10,0.44039612649992893,1,informational,61,2024-08-04
how long does it take to lose 100 pounds?,FALSE,,,10,0.44039612649992893,1,informational,53,2024-06-27
why is it so hard for me to lose weight?,FALSE,,,10,0.44039612649992893,1,,,
can you lose weight by exercise alone?,FALSE,,,10,0.44039612649992893,1,,,
what foods to eat to lose weight fast?,FALSE,,,10,0.44039612649992893,1,informational,66,2024-07-31
can you lose weight in a day?,FALSE,,,10,0.44039612649992893,1,,,
does not eating make you lose weight?,FALSE,,,10,0.44039612649992893,1,informational,52,2024-06-24
what causes rapid weight loss without trying?,FALSE,,,10,0.44039612649992893,1,informational,63,2024-07-15
is losing weight too fast bad?,FALSE,,,10,0.44039612649992893,1,,,
do you lose weight with coolsculpting?,FALSE,,,10,0.44039612649992893,1,informational,25,2024-08-10
how do you kill your appetite?,FALSE,,,10,0.44039612649992893,1,informational,58,2024-07-05
how can i slim down in 30 days?,FALSE,,,10,0.44039612649992893,1,informational,58,2024-07-17
is it bad to lose a lot of weight quickly?,FALSE,,,10,0.44039612649992893,1,,,
what type of exercise is best for losing weight?,FALSE,,,10,0.44039612649992893,1,informational,64,2024-07-31
what can you drink to lose weight fast?,FALSE,,,10,0.44039612649992893,1,commercial,60,2024-08-01
which diet is best for fat loss?,FALSE,,,10,0.44039612649992893,1,commercial,70,2024-07-30
what should i drink in the morning to lose belly fat?,FALSE,,,10,0.44039612649992893,1,informational,43,2024-07-14
how can i reduce my tummy in 15 days?,FALSE,,,10,0.44039612649992893,1,,,
which foods burn fat quickly?,FALSE,,,10,0.44039612649992893,1,,,
lose weight now free,FALSE,,,,0.5584140405339542,,,,
how to lose weight fast naturally with home remedies in india,FALSE,,,,0.5584140405339542,,commercial,49,2024-07-13
extreme weight loss where are they now hannah,FALSE,,,,0.5504435777528369,,informational,54,2024-08-06
lose weight naturally and quickly,FALSE,,,,0.4941208870222576,,,,
help loss,FALSE,,,,0.45056928782057937,,,,
help lose,FALSE,,,,0.45056928782057937,,,,
can i lose a stone in 4 weeks?,FALSE,,,,0.4495369891274706,,informational,43,2024-04-16
how can i lose 2lb a week?,FALSE,,,,0.4495369891274706,,informational,54,2024-07-17
how can i lose 100 pounds quickly?,FALSE,,,,0.4495369891274706,,informational,59,2024-07-19
how can i reduce my weight in 7 days?,FALSE,,,,0.4495369891274706,,informational,64,2024-07-17
what is the healthiest diet to lose weight?,FALSE,,,,0.4495369891274706,,commercial,72,2024-07-08
how can i lose weight fast and cheat?,FALSE,,,,0.4495369891274706,,informational,54,2024-07-17
how can i reduce my weight in 15 days?,FALSE,,,,0.4495369891274706,,informational,49,2024-08-03
can you lose 100 pounds in a year?,FALSE,,,,0.4495369891274706,,informational,53,2024-07-17
can you lose weight in 5 days?,FALSE,,,,0.4495369891274706,,,,
how do i lose 10 pounds fast?,FALSE,,,,0.4495369891274706,,,,
how can i lose weight in 10 days without dieting?,FALSE,,,,0.4495369891274706,,,,
what exercises can i do to lose 10 pounds in a week?,FALSE,,,,0.4495369891274706,,informational,61,2024-07-31
how can i slim down quickly?,FALSE,,,,0.4495369891274706,,informational,65,2024-08-03
how can i lose 5 pounds quickly?,FALSE,,,,0.4495369891274706,,,,
how can i reduce my weight in one month?,FALSE,,,,0.4495369891274706,,informational,63,2024-07-17
what foods cause rapid weight loss?,FALSE,,,,0.4495369891274706,,informational,64,2024-07-17
what can i drink to lose weight in a week?,FALSE,,,,0.4495369891274706,,commercial,59,2024-07-05
is slow weight loss better than fast?,FALSE,,,,0.4495369891274706,,informational,54,2024-07-05
how do i slim down?,FALSE,,,,0.4495369891274706,,informational,68,2024-07-05
how can a 13 year old lose weight fast and easy?,FALSE,,,,0.4495369891274706,,informational,56,2024-07-17
how can i lose 10 pounds in one week diet?,FALSE,,,,0.4495369891274706,,informational,62,2024-08-09
how do i completely lose my appetite?,FALSE,,,,0.4495369891274706,,informational,58,2024-07-05
how can i lose weight fast and permanently naturally?,FALSE,,,,0.4495369891274706,,,,
how do you lose weight if your skinny?,FALSE,,,,0.4495369891274706,,,,
how can i slim down in 2 weeks?,FALSE,,,,0.4495369891274706,,informational,53,2024-07-30
how can i lose weight fast and permanently?,FALSE,,,,0.4495369891274706,,informational,70,2024-07-17
how can i lose 11 pounds in a week?,FALSE,,,,0.4495369891274706,,,,
what is the best strategy to lose weight?,FALSE,,,,0.4495369891274706,,informational,68,2024-07-16
how can i lose weight by not eating?,FALSE,,,,0.4495369891274706,,,,
can you lose weight in 10 days?,FALSE,,,,0.4495369891274706,,informational,58,2024-07-05
what foods should i cut out to lose weight?,FALSE,,,,0.4495369891274706,,,,
what is the quickest way to lose 10 pounds?,FALSE,,,,0.4495369891274706,,,,
how can i lose weight and keep it permanently?,FALSE,,,,0.4495369891274706,,,,
what can i drink to lose weight fast home remedies?,FALSE,,,,0.4495369891274706,,informational,51,2024-07-17
what are the best weight loss tips?,FALSE,,,,0.4495369891274706,,informational,67,2023-11-15
what is best weight loss program?,FALSE,,,,0.4495369891274706,,informational,69,2024-08-06
how can i lose weight permanently and sensibly?,FALSE,,,,0.4495369891274706,,informational,69,2024-07-17
how do i start my weight loss day?,FALSE,,,,0.44039612649992893,,informational,55,2024-04-16
where do i start with weight loss?,FALSE,,,,0.44039612649992893,,informational,63,2024-06-27
how do i start losing weight in a day?,FALSE,,,,0.44039612649992893,,informational,60,2024-04-16
how can a beginner start losing weight?,FALSE,,,,0.44039612649992893,,informational,31,2024-07-17
what is the best way to start losing weight?,FALSE,,,,0.44039612649992893,,informational,70,2024-04-16
what should i eat to lose weight in 10 days?,FALSE,,,,0.44039612649992893,,informational,54,2024-08-12
what is the quickest weight loss diet?,FALSE,,,,0.44039612649992893,,informational,71,2024-08-12
do you lose weight faster if you are overweight?,FALSE,,,,0.44039612649992893,,informational,46,2024-06-27
how do you lose weight scientifically?,FALSE,,,,0.44039612649992893,,informational,72,2024-07-26
can you lose weight by just exercising?,FALSE,,,,0.44039612649992893,,informational,65,2023-11-15
is it better to lose weight slowly or quickly?,FALSE,,,,0.44039612649992893,,informational,52,2023-11-15
how many pounds can i lose in 3 days?,FALSE,,,,0.44039612649992893,,informational,57,2024-07-15
what is the trick to losing weight?,FALSE,,,,0.44039612649992893,,informational,68,2024-07-19
can losing weight make you sick?,FALSE,,,,0.44039612649992893,,informational,55,2024-07-15
is it dangerous to lose weight too fast?,FALSE,,,,0.44039612649992893,,informational,45,2024-07-17
how do you lose weight after losing it fast?,FALSE,,,,0.44039612649992893,,,,
can i lose 100 pounds in a year?,FALSE,,,,0.44039612649992893,,informational,38,2024-06-27
how can i lose weight fast on vacation?,FALSE,,,,0.44039612649992893,,,,
how can i lose weight fast without exercise in a week?,FALSE,,,,0.44039612649992893,,,,
can i lose weight in 7 days?,FALSE,,,,0.44039612649992893,,,,
how can i lose a large amount of weight fast?,FALSE,,,,0.44039612649992893,,informational,66,2024-07-17
how can i lose 20 pounds permanently?,FALSE,,,,0.44039612649992893,,,,
what ingredients help you lose weight?,FALSE,,,,0.44039612649992893,,informational,62,2024-07-26
how can i get motivated to lose weight again?,FALSE,,,,0.44039612649992893,,informational,47,2023-11-15
what is the cheapest way to lose weight?,FALSE,,,,0.44039612649992893,,informational,52,2024-06-29
how can i lose weight extremely fast?,FALSE,,,,0.44039612649992893,,informational,63,2023-11-15
how can i lose weight fast and consistently?,FALSE,,,,0.44039612649992893,,informational,69,2024-04-16
how can i lose weight fast insanely?,FALSE,,,,0.44039612649992893,,informational,62,2024-07-17
how can i trick my mind to lose weight?,FALSE,,,,0.44039612649992893,,,,
how can i maximize my weight loss?,FALSE,,,,0.44039612649992893,,informational,70,2024-07-15
how do you lose weight in a day by day?,FALSE,,,,0.44039612649992893,,informational,53,2023-11-15
what is the trick to lose weight fast?,FALSE,,,,0.44039612649992893,,informational,68,2024-07-17
how can i lose weight even if it's unhealthy?,FALSE,,,,0.44039612649992893,,,,
what to eat when you're trying to lose weight?,FALSE,,,,0.44039612649992893,,commercial,64,2024-07-05
how can i cheat to lose weight?,FALSE,,,,0.44039612649992893,,informational,50,2024-08-02
how can i drastically lose weight in a month?,FALSE,,,,0.44039612649992893,,,,
how quickly can i lose 50 pounds?,FALSE,,,,0.44039612649992893,,,,
how much weight can you realistically lose in 4 weeks?,FALSE,,,,0.44039612649992893,,,,
how do you lose weight on the ultimate weight loss guide?,FALSE,,,,0.44039612649992893,,informational,57,2024-04-16
why do i lose more weight when not exercising?,FALSE,,,,0.44039612649992893,,informational,56,2024-08-10
what can you eat on extreme weight loss?,FALSE,,,,0.44039612649992893,,informational,63,2024-07-17
what actually works weight loss?,FALSE,,,,0.44039612649992893,,informational,69,2024-07-17
is it possible to lose belly fat in a week?,FALSE,,,,0.44039612649992893,,,,
what small changes can i make to lose weight?,FALSE,,,,0.44039612649992893,,informational,48,2023-11-15
can you lose weight just by changing diet?,FALSE,,,,0.44039612649992893,,,,
how much weight can you lose intermittent fasting?,FALSE,,,,0.44039612649992893,,,,
how do i get skinny without trying?,FALSE,,,,0.44039612649992893,,,,
is it possible to lose 10 pounds in 3 days?,FALSE,,,,0.44039612649992893,,,,
how can i lose the most weight in 10 days?,FALSE,,,,0.44039612649992893,,,,
how do i change my mindset to lose weight?,FALSE,,,,0.44039612649992893,,informational,43,2024-07-17
how do i change my lifestyle to lose weight?,FALSE,,,,0.44039612649992893,,,,
how do you change your mindset to lose weight?,FALSE,,,,0.44039612649992893,,informational,39,2023-11-15
how can 60 year old woman lose weight?,FALSE,,,,0.44039612649992893,,informational,51,2024-07-11
what should i eat to lose weight and tone up?,FALSE,,,,0.44039612649992893,,commercial,57,2024-07-05
how can i lose weight drastically in a week?,FALSE,,,,0.44039612649992893,,,,
how much water weight can you lose in a day?,FALSE,,,,0.44039612649992893,,,,
can you lose 15 pounds in 4 weeks?,FALSE,,,,0.44039612649992893,,,,
how can i lose weight smart?,FALSE,,,,0.44039612649992893,,,,
how much weight can you lose in three days?,FALSE,,,,0.44039612649992893,,,,
can you lose weight by just eating right?,FALSE,,,,0.44039612649992893,,informational,55,2023-11-15
how can i slim down fast and healthy?,FALSE,,,,0.44039612649992893,,,,
how can i lose weight in 4 days?,FALSE,,,,0.44039612649992893,,informational,59,2024-07-17
what diet can you lose weight the fastest?,FALSE,,,,0.44039612649992893,,,,
why am i having a hard time losing weight?,FALSE,,,,0.44039612649992893,,informational,53,2023-11-15
how can i lose weight in 3 days without diet and exercise?,FALSE,,,,0.44039612649992893,,,,
what is the healthiest weight loss program?,FALSE,,,,0.44039612649992893,,informational,70,2024-07-17
how do you guarantee weight loss?,FALSE,,,,0.44039612649992893,,informational,65,2024-07-15
what you should know about losing weight?,FALSE,,,,0.44039612649992893,,informational,63,2023-11-15
do you gain weight before losing weight?,FALSE,,,,0.44039612649992893,,,,
how do i write a weight loss plan?,FALSE,,,,0.44039612649992893,,,,
what is the best home remedy for weight loss?,FALSE,,,,0.44039612649992893,,,,
how can i accelerate my weight loss?,FALSE,,,,0.44039612649992893,,informational,71,2024-06-24
how do i lose that last 10 pounds?,FALSE,,,,0.44039612649992893,,,,
how do i start a weight loss plan?,FALSE,,,,0.44039612649992893,,informational,59,2024-07-16
how can i get extreme weight loss fast?,FALSE,,,,0.44039612649992893,,,,
how much weight can u lose in 4 weeks?,FALSE,,,,0.44039612649992893,,informational,54,2024-07-06
what are the side effects of rapid weight loss?,FALSE,,,,0.44039612649992893,,informational,57,2024-07-17
how can i lose weight consistently?,FALSE,,,,0.44039612649992893,,,,
what is the fastest way to lose weight on a crash diet?,FALSE,,,,0.44039612649992893,,,,
what diet has the fastest results?,FALSE,,,,0.44039612649992893,,,,
how is the fastest way to lose 20 pounds?,FALSE,,,,0.44039612649992893,,informational,59,2024-07-17
how can i lose 10 pounds fast?,FALSE,,,,0.44039612649992893,,informational,52,2024-06-26
what is the secret to losing weight?,FALSE,,,,0.44039612649992893,,informational,74,2024-07-17
how much weight do you lose before you show?,FALSE,,,,0.44039612649992893,,informational,54,2024-07-17
how can a man lose weight in 2 weeks?,FALSE,,,,0.44039612649992893,,,,
how much can you lose in 2 weeks?,FALSE,,,,0.44039612649992893,,,,
how can i lose weight in 6 days?,FALSE,,,,0.44039612649992893,,,,
what is the fastest way to lose weight dramatically?,FALSE,,,,0.44039612649992893,,informational,70,2024-07-19
what is the cheapest way to lose weight fast?,FALSE,,,,0.44039612649992893,,,,
how fast can i lose weight and see results?,FALSE,,,,0.44039612649992893,,,,
how can i get skinny in 3 weeks?,FALSE,,,,0.44039612649992893,,,,
can you lose weight on diet alone?,FALSE,,,,0.44039612649992893,,,,
how do you lose weight with lifestyle changes?,FALSE,,,,0.44039612649992893,,,,
can you lose weight by studying?,FALSE,,,,0.44039612649992893,,,,
how can i lose weight while studying for an exam?,FALSE,,,,0.44039612649992893,,,,
what diet works the fastest?,FALSE,,,,0.44039612649992893,,,,
is it possible to lose weight in 3 days?,FALSE,,,,0.44039612649992893,,,,
can i lose weight by just changing my diet?,FALSE,,,,0.44039612649992893,,,,
how can i change my small diet?,FALSE,,,,0.44039612649992893,,informational,53,2024-07-07
how much can you lose weight in 2 months?,FALSE,,,,0.44039612649992893,,,,
does cinnamon help burn belly fat?,FALSE,,,,0.44039612649992893,,,,
how can i lose weight and get skinny?,FALSE,,,,0.44039612649992893,,,,
is it difficult to lose weight after 30?,FALSE,,,,0.44039612649992893,,,,
how can i lose weight fast at work?,FALSE,,,,0.44039612649992893,,,,
can work make you lose weight?,FALSE,,,,0.44039612649992893,,,,
how can i lose weight in a healthy way sustainably?,FALSE,,,,0.44039612649992893,,informational,44,2023-11-15
how do i lose weight as a lifestyle?,FALSE,,,,0.44039612649992893,,,,
do you lose weight everyday?,FALSE,,,,0.44039612649992893,,,,
how many calories should a woman over 50 have a day?,FALSE,,,,0.44039612649992893,,,,
how can i lose weight after 50 and menopause?,FALSE,,,,0.44039612649992893,,,,
how can i lose fat in 30 days?,FALSE,,,,0.44039612649992893,,,,
what is the fastest way to lose 10 pounds?,FALSE,,,,0.44039612649992893,,,,
how do you shock your body to burn fat?,FALSE,,,,0.44039612649992893,,,,
how can i speed up my body fat loss?,FALSE,,,,0.44039612649992893,,,,
what can you do for extreme weight loss?,FALSE,,,,0.44039612649992893,,informational,71,2024-08-12
how can i reduce my 15 days?,FALSE,,,,0.44039612649992893,,,,
what is the safest weight loss program?,FALSE,,,,0.44039612649992893,,commercial,71,2024-07-16
what exactly should i eat to lose weight?,FALSE,,,,0.44039612649992893,,,,
what is the number one key to losing weight?,FALSE,,,,0.44039612649992893,,informational,58,2024-07-17
how can i lose 10 pounds in 10 days naturally?,FALSE,,,,0.44039612649992893,,,,
how can i lose intense weight?,FALSE,,,,0.44039612649992893,,,,
how can i lose weight in a week without exercise?,FALSE,,,,0.44039612649992893,,,,
