Keyword,Tracked,Campaigns,Min Monthly Volume,Max Monthly Volume,Relevancy,Monthly Volume,Search Intent,Difficulty,Last Updated
what works best for weight loss?,FALSE,,,,0.44039612649992893,,,,
what exercise is best for losing weight?,FALSE,,,,0.44039612649992893,,informational,57,2024-07-17
can i lose weight without diet pills?,FALSE,,,,0.44039612649992893,,,,
is diet or exercise better for weight loss?,FALSE,,,,0.44039612649992893,,informational,55,2024-08-10
how can i lose my belly fat in 15 days?,FALSE,,,,0.44039612649992893,,informational,65,2024-07-01
how do i start a weight loss journey?,FALSE,,,,0.44039612649992893,,informational,48,2024-07-22
what are the best ways to lose weight at home?,FALSE,,,,0.44039612649992893,,,,
what diet is best for weight loss?,FALSE,,,,0.44039612649992893,,commercial,72,2024-07-31
how can i get skinny without doing anything?,FALSE,,,,0.44039612649992893,,,,
what causes sudden weight loss?,FALSE,,,,0.44039612649992893,,,,
is extreme weight loss coming back?,FALSE,,,,0.44039612649992893,,informational,68,2024-04-16
what is a good weight loss per week?,FALSE,,,,0.44039612649992893,,informational,68,2024-04-16
how can i lose weight in general?,FALSE,,,,0.44039612649992893,,,,
does losing weight make you healthier?,FALSE,,,,0.44039612649992893,,informational,51,2024-07-23
can science help you lose weight?,FALSE,,,,0.44039612649992893,,,,
can you lose weight by diet alone?,FALSE,,,,0.44039612649992893,,,,
how can i lose weight for free?,FALSE,,,,0.44039612649992893,,informational,71,2024-07-30
what is the best way to lose weight and see results?,FALSE,,,,0.44039612649992893,,informational,75,2024-07-15
how can i lose weight while studying?,FALSE,,,,0.44039612649992893,,,,
can you lose weight just by eating smaller portions?,FALSE,,,,0.44039612649992893,,,,
what is most effective for weight loss?,FALSE,,,,0.44039612649992893,,,,
how can i lose body fat in a week?,FALSE,,,,0.44039612649992893,,,,
how do you lose 30 pounds in a week?,FALSE,,,,0.44039612649992893,,,,
how can i get skinny forever?,FALSE,,,,0.44039612649992893,,,,
how do you lose weight with simple changes?,FALSE,,,,0.44039612649992893,,,,
why is losing weight so difficult?,FALSE,,,,0.44039612649992893,,,,
what will losing 20 pounds do?,FALSE,,,,0.44039612649992893,,,,
how do u lose belly fat in 2 days?,FALSE,,,,0.44039612649992893,,,,
can you lose 10 pounds in a day?,FALSE,,,,0.44039612649992893,,,,
how do beginners lose weight?,FALSE,,,,0.44039612649992893,,informational,36,2024-03-10
how do you lose weight facts?,FALSE,,,,0.44039612649992893,,informational,66,2023-11-15
which diet is best to lose weight fast?,FALSE,,,,0.44039612649992893,,,,
what is the fastest way for a man to lose weight?,FALSE,,,,0.44039612649992893,,,,
is fitbit good for losing weight?,FALSE,,,,0.44039612649992893,,,,
how can i lose 10 pounds in 30 days?,FALSE,,,,0.44039612649992893,,informational,49,2024-07-17
how can i lose weight fast in 7 days?,FALSE,,,,0.44039612649992893,,,,
how can i lose a few pounds a week?,FALSE,,,,0.44039612649992893,,,,
how can i lose 10 pounds in 5 days?,FALSE,,,,0.44039612649992893,,,,
how can i lose weight by doing nothing?,FALSE,,,,0.44039612649992893,,,,
how can i lose my last stubborn 5 pounds?,FALSE,,,,0.44039612649992893,,,,
what does a nutritionist do to help you lose weight?,FALSE,,,,0.44039612649992893,,informational,41,2024-07-21
how much weight can you lose fasting for a week?,FALSE,,,,0.44039612649992893,,,,
how can i lose a little weight every day?,FALSE,,,,0.44039612649992893,,,,
how much is the weight loss industry worth 2017?,FALSE,,,,0.44039612649992893,,,,
can you lose weight by just working out?,FALSE,,,,0.44039612649992893,,,,
can just changing your diet make you lose weight?,FALSE,,,,0.44039612649992893,,informational,49,2024-07-17
what are some components of a successful diet weight loss plan?,FALSE,,,,0.44039612649992893,,informational,39,2024-06-10
do obese people lose weight faster?,FALSE,,,,0.44039612649992893,,informational,44,2024-06-27
what is the safest weight loss?,FALSE,,,,0.44039612649992893,,informational,72,2023-11-15
how can i maximize weight loss in a month?,FALSE,,,,0.44039612649992893,,,,
how can i increase my metabolic rate to lose weight?,FALSE,,,,0.44039612649992893,,,,
how can i maximize my fat loss?,FALSE,,,,0.44039612649992893,,,,
how can i lose weight in 5 days naturally?,FALSE,,,,0.44039612649992893,,,,
how can i lose weight fast without supplements?,FALSE,,,,0.44039612649992893,,,,
is it possible to lose fat and not weight?,FALSE,,,,0.44039612649992893,,,,
how do you lose permanent weight fast?,FALSE,,,,0.44039612649992893,,,,
how do you lose weight when your small?,FALSE,,,,0.44039612649992893,,,,
what are the steps to losing baby weight?,FALSE,,,,0.44039612649992893,,,,
what diets work the fastest?,FALSE,,,,0.44039612649992893,,,,
what are the best free apps for weight loss?,FALSE,,,,0.44039612649992893,,commercial,53,2024-08-09
how can i lose weight fast and cheaply?,FALSE,,,,0.44039612649992893,,,,
how can i reduce my fat in 15 days?,FALSE,,,,0.44039612649992893,,,,
how can i lose weight in 15 days diet?,FALSE,,,,0.44039612649992893,,,,
how much weight you can lose in a week?,FALSE,,,,0.44039612649992893,,,,
how do you lose weight if your fat?,FALSE,,,,0.44039612649992893,,,,
is it easier for an obese person to lose weight?,FALSE,,,,0.44039612649992893,,,,
how can an obese person lose weight?,FALSE,,,,0.44039612649992893,,informational,57,2024-07-17
how much should i exercise to lose weight?,FALSE,,,,0.44039612649992893,,informational,60,2024-07-01
why don't i lose weight when i exercise?,FALSE,,,,0.44039612649992893,,,,
what happens if you lose weight too quickly?,FALSE,,,,0.44039612649992893,,informational,56,2024-07-17
what can i do to lose weight in 30 days?,FALSE,,,,0.44039612649992893,,informational,65,2024-05-16
how can a lazy person get skinny?,FALSE,,,,0.44039612649992893,,informational,41,2023-11-15
how much weight is it healthy to lose in a week?,FALSE,,,,0.44039612649992893,,,,
what do i need to know about losing weight?,FALSE,,,,0.44039612649992893,,,,
how can i slim down naturally fast?,FALSE,,,,0.44039612649992893,,,,
how can i trick myself into losing weight?,FALSE,,,,0.44039612649992893,,informational,49,2024-07-15
is keto the fastest way to lose weight?,FALSE,,,,0.44039612649992893,,,,
how can i lose weight fast without diet pills?,FALSE,,,,0.44039612649992893,,,,
is rapid weight loss dangerous?,FALSE,,,,0.44039612649992893,,,,
what weight loss program works the best?,FALSE,,,,0.44039612649992893,,commercial,67,2024-07-30
what is the fastest way to lose weight in 2 weeks?,FALSE,,,,0.44039612649992893,,,,
how long after starting a diet should you see results?,FALSE,,,,0.44039612649992893,,,,
how can i lose 15 pounds and keep it off?,FALSE,,,,0.44039612649992893,,,,
does chocolate make you skinny?,FALSE,,,,0.44039612649992893,,,,
what pills can i take to lose weight without exercise?,FALSE,,,,0.44039612649992893,,,,
is it actually possible to lose weight?,FALSE,,,,0.44039612649992893,,informational,67,2023-11-16
how can i lose weight long term?,FALSE,,,,0.44039612649992893,,,,
what is a realistic goal for weight loss per week?,FALSE,,,,0.44039612649992893,,informational,49,2024-07-05
what happens if you lose weight too fast?,FALSE,,,,0.44039612649992893,,,,
how can i lose weight in 20 days?,FALSE,,,,0.44039612649992893,,,,
can you lose weight without dieting?,FALSE,,,,0.44039612649992893,,,,
can nutritionists help you lose weight?,FALSE,,,,0.44039612649992893,,,,
how can i reduce fat quickly?,FALSE,,,,0.44039612649992893,,,,
what percent of dieters will regain lost weight within two years?,FALSE,,,,0.44039612649992893,,,,
what kind of doctor specializes in weight loss?,FALSE,,,,0.44039612649992893,,informational,27,2024-07-16
how can i lose weight in a month without exercise?,FALSE,,,,0.44039612649992893,,,,
what diet works best?,FALSE,,,,0.44039612649992893,,commercial,70,2024-07-15
how can i lose weight constantly?,FALSE,,,,0.44039612649992893,,,,
is it healthy to lose 2 lbs a week?,FALSE,,,,0.44039612649992893,,,,
what are the key components of successful weight loss?,FALSE,,,,0.44039612649992893,,,,
how can i lose weight with home remedies?,FALSE,,,,0.44039612649992893,,,,
how do i speed up my weight loss?,FALSE,,,,0.44039612649992893,,,,
how do you lose body fat quickly?,FALSE,,,,0.44039612649992893,,,,
what is the fastest way to lose weight in 2 months?,FALSE,,,,0.44039612649992893,,,,
how can i reduce my weight in 10 days?,FALSE,,,,0.44039612649992893,,,,
how can i get slim in 30 days?,FALSE,,,,0.44039612649992893,,,,
is it possible to lose weight in a month?,FALSE,,,,0.44039612649992893,,informational,57,2024-07-17
what is the fastest way to lose weight in 30 days?,FALSE,,,,0.44039612649992893,,,,
how can i lose my fat in 20 days?,FALSE,,,,0.44039612649992893,,,,
how can i get skinny in 20 days?,FALSE,,,,0.44039612649992893,,,,
how do you burn fat naturally?,FALSE,,,,0.44039612649992893,,,,
which food is good for weight loss?,FALSE,,,,0.44039612649992893,,,,
are there any safe weight loss supplements?,FALSE,,,,0.44039612649992893,,,,
what is the best scientifically proven way to lose weight?,FALSE,,,,0.44039612649992893,,,,
is white rice bad for losing weight?,FALSE,,,,0.44039612649992893,,,,
what is the best way to lose weight permanently?,FALSE,,,,0.44039612649992893,,,,
how to lose belly fat,FALSE,,30301,70800,0.38025634430727023,55766,informational,71,2024-08-08
weight loss diet,FALSE,,11501,30300,0.38025634430727023,13734,commercial,76,2024-08-07
weight loss foods,FALSE,,11501,30300,0.38025634430727023,13734,commercial,67,2024-08-01
7 day diet plan for weight loss,FALSE,,4301,6500,0.38025634430727023,6050,informational,46,2024-08-05
how to lose weight in 7 days,FALSE,,2901,4300,0.38025634430727023,3346,informational,66,2024-08-12
extreme weight loss methods,FALSE,,1701,2900,0.38025634430727023,2737,informational,64,2024-08-10
how to lose weight fast with exercise,FALSE,,1701,2900,0.38025634430727023,1825,informational,63,2024-08-09
lost weight,FALSE,,501,850,0.38639326989698797,731,,,
how to lose,FALSE,,201,500,0.3844913082830287,444,informational,72,2024-08-12
weight log,FALSE,,201,500,0.38419713252741905,383,,,
fat loss diet plan for female,FALSE,,201,500,0.38025634430727023,365,informational,51,2024-08-11
why am i not losing weight on the keto diet?,FALSE,,201,500,0.386685746352413,275,informational,50,2024-08-06
how to start losing weight for beginners,FALSE,,101,200,0.38025634430727023,196,informational,35,2024-07-17
what medical conditions can stop you from losing weight?,FALSE,,101,200,0.386685746352413,185,informational,37,2024-06-29
meal plan for extreme weight loss,FALSE,,51,100,0.38025634430727023,87,informational,59,2024-08-11
what is the best weight loss program?,FALSE,,51,100,0.386685746352413,82,commercial,69,2024-07-31
how much weight can you lose in 3 months?,FALSE,,51,100,0.386685746352413,64,informational,49,2024-07-05
how can i fast safely?,FALSE,,51,100,0.386685746352413,64,informational,58,2024-05-03
how can i boost up my metabolism?,FALSE,,51,100,0.386685746352413,64,,,
weight loss kick start,FALSE,,51,100,0.39284568462468805,55,,,
how can i get a flat stomach without exercise?,FALSE,,11,50,0.386685746352413,47,,,
can i lose 20 pounds in 6 weeks?,FALSE,,11,50,0.386685746352413,27,,,
how much weight can you lose in two days?,FALSE,,11,50,0.386685746352413,27,,,
how can i lose 20 pounds in a week?,FALSE,,11,50,0.386685746352413,27,,,
what type of doctor should i see for weight loss?,FALSE,,11,50,0.386685746352413,27,informational,27,2024-08-09
how much weight will you lose if you don't eat for a week?,FALSE,,11,50,0.386685746352413,27,,,
where do you start losing weight first?,FALSE,,11,50,0.386685746352413,24,informational,50,2024-04-16
how can i lose 7 pounds in 7 days?,FALSE,,11,50,0.386685746352413,24,,,
can i lose 10 lbs in a week?,FALSE,,11,50,0.386685746352413,24,,,
can you lose 15 pounds in a month?,FALSE,,11,50,0.386685746352413,24,,,
how much do you weigh?,FALSE,,11,50,0.386685746352413,24,,,
can i lose weight if i don't eat?,FALSE,,11,50,0.386685746352413,24,,,
how many steps should you do in a day to lose weight?,FALSE,,11,50,0.386685746352413,24,,,
how can i lose 10 pounds in a week?,FALSE,,11,50,0.386685746352413,24,,,
what vitamin deficiency causes weight gain?,FALSE,,11,50,0.386685746352413,17,,,
what are the 7 foods to avoid?,FALSE,,11,50,0.386685746352413,14,,,
how can i speed up weight loss on weight watchers?,FALSE,,11,50,0.386685746352413,11,,,
how much weight can i lose eating 800 calories a day?,FALSE,,,10,0.386685746352413,11,informational,52,2024-07-19
how much should i exercise to lose 2 pounds a week?,FALSE,,,10,0.386685746352413,7,informational,51,2024-07-20
how can i drop 10 pounds in a month?,FALSE,,,10,0.386685746352413,6,,,
kick start weight loss diet,FALSE,,,10,0.38944680260946074,5,informational,57,2024-08-11
which beachbody program is best for weight loss?,FALSE,,,10,0.386685746352413,5,informational,41,2024-07-31
how can i track my weight loss progress?,FALSE,,,10,0.386685746352413,3,,,
what is the best weight loss app?,FALSE,,,10,0.386685746352413,3,commercial,53,2024-07-14
how much weight can you lose in a year?,FALSE,,,10,0.386685746352413,2,informational,51,2024-07-17
what causes weight loss?,FALSE,,,10,0.386685746352413,2,,,
how do i lose 1 pound a day?,FALSE,,,10,0.386685746352413,2,,,
what is the healthiest dinner for weight loss?,FALSE,,,10,0.386685746352413,2,informational,60,2024-07-17
can you lose 10lbs in 3 days?,FALSE,,,10,0.386685746352413,2,,,
how to start a weight loss group,FALSE,,,10,0.3877093522512654,1,,,
what is the best way to start a diet?,FALSE,,,10,0.386685746352413,1,informational,63,2024-04-16
how many steps a day do i need to take to lose 2 pounds a week?,FALSE,,,10,0.386685746352413,1,,,
how can i lose weight on keto diet?,FALSE,,,10,0.386685746352413,1,informational,71,2024-08-01
how can i lose a pound a day without exercise?,FALSE,,,10,0.386685746352413,1,,,
how much can you lose in 6 weeks?,FALSE,,,10,0.386685746352413,1,,,
can you lose 7 pounds in a week?,FALSE,,,10,0.386685746352413,1,,,
how do i lose 10lbs in a week?,FALSE,,,10,0.386685746352413,1,,,
can i lose weight by simply eating less?,FALSE,,,10,0.386685746352413,1,,,
is it possible to lose weight in 10 days?,FALSE,,,10,0.386685746352413,1,,,
how long does it take to lose 15 pounds?,FALSE,,,10,0.386685746352413,1,,,
will i lose weight if i stop eating for 3 days?,FALSE,,,10,0.386685746352413,1,informational,58,2024-06-25
how do i get rid of water retention overnight?,FALSE,,,10,0.386685746352413,1,,,
what is the best strategy for weight loss?,FALSE,,,10,0.386685746352413,1,,,
how long does it take to lose 5 pounds?,FALSE,,,10,0.386685746352413,1,,,
how do you get skinny in one day?,FALSE,,,10,0.386685746352413,1,informational,60,2024-07-11
can you lose 10 pounds in 3 weeks?,FALSE,,,10,0.386685746352413,1,,,
why am i losing weight so fast without trying?,FALSE,,,10,0.386685746352413,1,,,
is it possible to lose 10 pounds in a month?,FALSE,,,10,0.386685746352413,1,,,
can you lose belly fat without running?,FALSE,,,10,0.386685746352413,1,,,
starting a weight loss program at work,FALSE,,,,0.3876595796414497,,,,
how successful is a weight loss journey?,FALSE,,,,0.386685746352413,,informational,68,2024-04-16
how can i start losing weight at home?,FALSE,,,,0.386685746352413,,informational,66,2024-06-27
how can i stay motivated to lose weight?,FALSE,,,,0.386685746352413,,informational,47,2024-07-21
how do i mentally prepare myself to lose weight?,FALSE,,,,0.386685746352413,,informational,31,2024-04-16
what should i do in the morning to lose weight?,FALSE,,,,0.386685746352413,,informational,46,2024-04-16
how do you start the weight loss process?,FALSE,,,,0.386685746352413,,informational,61,2024-04-16
how do you jumpstart your metabolism?,FALSE,,,,0.386685746352413,,informational,54,2024-04-16
how can i start losing weight slowly?,FALSE,,,,0.386685746352413,,informational,65,2024-04-16
how do i start my weight loss journey?,FALSE,,,,0.386685746352413,,informational,48,2024-04-16
how do i start a new diet?,FALSE,,,,0.386685746352413,,informational,51,2024-04-16
how do i start losing weight and get fit?,FALSE,,,,0.386685746352413,,informational,66,2024-06-27
how do i decide to lose weight?,FALSE,,,,0.386685746352413,,informational,69,2024-04-16
what is the best way to track weight loss?,FALSE,,,,0.386685746352413,,,,
how do i prepare for a weight loss journey?,FALSE,,,,0.386685746352413,,informational,46,2024-04-16
how do i jump start my weight loss?,FALSE,,,,0.386685746352413,,informational,48,2024-04-16
how do you know your losing weight?,FALSE,,,,0.386685746352413,,,,
how can i start my weightloss journey?,FALSE,,,,0.386685746352413,,,,
how can i weigh less the next day?,FALSE,,,,0.386685746352413,,,,
what ingredients help lose weight?,FALSE,,,,0.386685746352413,,,,
what drinks can i make to lose weight?,FALSE,,,,0.386685746352413,,,,
can drinking a lot of water help lose weight?,FALSE,,,,0.386685746352413,,,,
what's the quickest way to lose weight?,FALSE,,,,0.386685746352413,,,,
how can a lazy person lose weight fast?,FALSE,,,,0.386685746352413,,,,
how can i lose 10 pounds slowly?,FALSE,,,,0.386685746352413,,,,
does weight loss get easier?,FALSE,,,,0.386685746352413,,,,
how many kgs can i lose in a week?,FALSE,,,,0.386685746352413,,,,
what is the best diet pills to lose weight fast?,FALSE,,,,0.386685746352413,,,,
how can heart patients lose weight?,FALSE,,,,0.386685746352413,,informational,52,2024-06-23
what can you drink on the potato diet?,FALSE,,,,0.386685746352413,,,,
how can i lose 10 pounds and keep it off?,FALSE,,,,0.386685746352413,,,,
can i lose weight if i stop eating?,FALSE,,,,0.386685746352413,,,,
how can i get fat loss fast?,FALSE,,,,0.386685746352413,,,,
how can a girl get lean fast?,FALSE,,,,0.386685746352413,,,,
how can i lose 7lb in a week?,FALSE,,,,0.386685746352413,,,,
how can i lose 6 pounds in a week?,FALSE,,,,0.386685746352413,,,,
can i lose 6lb in 3 days?,FALSE,,,,0.386685746352413,,informational,54,2024-06-22
what are the steps to reduce belly fat?,FALSE,,,,0.386685746352413,,,,
what can i do to lose weight instantly?,FALSE,,,,0.386685746352413,,,,
how much weight do you lose on south beach diet?,FALSE,,,,0.386685746352413,,,,
how can i lose 4 kilos in a week?,FALSE,,,,0.386685746352413,,,,
how many kilos can you lose in 7 weeks?,FALSE,,,,0.386685746352413,,,,
what causes unexplained weight loss?,FALSE,,,,0.386685746352413,,informational,64,2024-04-16
how much weight can you lose in 48 days?,FALSE,,,,0.386685746352413,,,,
can you lose 9 pounds in a week?,FALSE,,,,0.386685746352413,,,,
how long will it take to lose 9 pounds?,FALSE,,,,0.386685746352413,,,,
how can i lose 9 pounds in a month?,FALSE,,,,0.386685746352413,,,,
how do you lose weight drastically?,FALSE,,,,0.386685746352413,,,,
how do i find the willpower to lose weight?,FALSE,,,,0.386685746352413,,,,
can you lose weight with a cheat day?,FALSE,,,,0.386685746352413,,,,
is it ok to cheat on diet?,FALSE,,,,0.386685746352413,,,,
how can i treat my weight loss?,FALSE,,,,0.386685746352413,,informational,63,2024-07-23
what is the food diet?,FALSE,,,,0.386685746352413,,,,
what is medical weight management?,FALSE,,,,0.386685746352413,,informational,30,2024-07-14
how can i plan to lose weight?,FALSE,,,,0.386685746352413,,informational,64,2024-07-14
how do you help someone lose weight when they don't want to?,FALSE,,,,0.386685746352413,,informational,45,2024-03-10
how do i make a balanced meal plan?,FALSE,,,,0.386685746352413,,informational,49,2024-07-03
what's the secret to losing weight?,FALSE,,,,0.386685746352413,,,,
is losing 7 pounds in a week healthy?,FALSE,,,,0.386685746352413,,,,
what is the easiest way to lose 7 pounds in a week?,FALSE,,,,0.386685746352413,,,,
how fit can you get in 3 days?,FALSE,,,,0.386685746352413,,,,
how can i get fit in a week at home?,FALSE,,,,0.386685746352413,,commercial,53,2024-06-27
how do i get really fit fast?,FALSE,,,,0.386685746352413,,,,
where do i start with losing weight?,FALSE,,,,0.386685746352413,,informational,63,2024-04-16
how can i lose 5lbs in 2 days?,FALSE,,,,0.386685746352413,,,,
how many calories should i eat a day to lose weight australia?,FALSE,,,,0.386685746352413,,informational,35,2024-06-22
how can i lose weight fast as a kid?,FALSE,,,,0.386685746352413,,,,
how do you maintain willpower when dieting?,FALSE,,,,0.386685746352413,,,,
what everyday things can i do to lose weight?,FALSE,,,,0.386685746352413,,informational,60,2023-11-15
should i be losing weight every day?,FALSE,,,,0.386685746352413,,,,
why is not eating bad for losing weight?,FALSE,,,,0.386685746352413,,,,
what happens if you exercise without dieting?,FALSE,,,,0.386685746352413,,,,
can you lose 20 pounds in 4 weeks?,FALSE,,,,0.386685746352413,,,,
can you lose 10 pounds in 6 weeks?,FALSE,,,,0.386685746352413,,,,
how can i lose weight fast in 7 weeks?,FALSE,,,,0.386685746352413,,,,
how much fat can you lose in 6 weeks?,FALSE,,,,0.386685746352413,,,,
can you lose 20 pounds in 6 weeks?,FALSE,,,,0.386685746352413,,,,
can you lose 25 pounds in 7 weeks?,FALSE,,,,0.386685746352413,,,,
can i lose 10 pounds in 6 weeks?,FALSE,,,,0.386685746352413,,,,
can i lose weight in 6 weeks?,FALSE,,,,0.386685746352413,,,,
can you lose a stone in 7 weeks?,FALSE,,,,0.386685746352413,,,,
how can i lose 7lbs in a week?,FALSE,,,,0.386685746352413,,,,
how can i lose the most weight in a short time?,FALSE,,,,0.386685746352413,,,,
how can i slim down in 3 weeks?,FALSE,,,,0.386685746352413,,,,
can you lose weight in 4 weeks?,FALSE,,,,0.386685746352413,,,,
can i lose 3 pounds in 3 days?,FALSE,,,,0.386685746352413,,,,
how can i lose weight fast for men?,FALSE,,,,0.386685746352413,,informational,57,2024-06-11
what is weight reduction?,FALSE,,,,0.386685746352413,,,,
what are the 7 foods to avoid in the virgin diet?,FALSE,,,,0.386685746352413,,informational,41,2024-06-27
is it normal to feel weak on a diet?,FALSE,,,,0.386685746352413,,,,
does losing weight make you feel weak?,FALSE,,,,0.386685746352413,,,,
will i get weaker if i lose weight?,FALSE,,,,0.386685746352413,,,,
how can i lose weight and not stay hungry?,FALSE,,,,0.386685746352413,,,,
is it possible to lose 9 pounds in a week?,FALSE,,,,0.386685746352413,,,,
how can i lose weight fast and guaranteed?,FALSE,,,,0.386685746352413,,,,
how can i lose weight fast in 2 days?,FALSE,,,,0.386685746352413,,,,
why is it difficult to lose weight?,FALSE,,,,0.386685746352413,,informational,57,2023-11-15
is it safe to lose 10 pounds in a week?,FALSE,,,,0.386685746352413,,,,
how long does it take to lose 5 lbs of fat?,FALSE,,,,0.386685746352413,,,,
can i lose 5 pounds in 5 days?,FALSE,,,,0.386685746352413,,,,
can you lose weight by just changing your diet?,FALSE,,,,0.386685746352413,,,,
can you lose weight just by changing your diet?,FALSE,,,,0.386685746352413,,,,
how do i lose weight after 70?,FALSE,,,,0.386685746352413,,,,
what is the best diet for seniors?,FALSE,,,,0.386685746352413,,commercial,56,2024-08-06
what time should you stop eating at night to lose weight?,FALSE,,,,0.386685746352413,,,,
can you lose weight with just diet?,FALSE,,,,0.386685746352413,,,,
can i lose 10 pounds in 4 weeks?,FALSE,,,,0.386685746352413,,,,
how can i lose weight visibly fast?,FALSE,,,,0.386685746352413,,,,
what is the fastest way to lose weight for an event?,FALSE,,,,0.386685746352413,,,,
how do you slim down before a big event?,FALSE,,,,0.386685746352413,,,,
can you lose weight in a couple of days?,FALSE,,,,0.386685746352413,,,,
can you lose 10 pounds in 9 days?,FALSE,,,,0.386685746352413,,,,
how much fat can i lose in 10 days?,FALSE,,,,0.386685746352413,,,,
what's a guaranteed way to lose weight?,FALSE,,,,0.386685746352413,,,,
how can i lose 10 pounds in 4 days?,FALSE,,,,0.386685746352413,,,,
how much weight can you lose by fasting for 3 days?,FALSE,,,,0.386685746352413,,informational,49,2024-07-05
what exercises can i do to lose 10 pounds in a month?,FALSE,,,,0.386685746352413,,,,
what are loss tips?,FALSE,,,,0.386685746352413,,,,
how can i lose weight smartly?,FALSE,,,,0.386685746352413,,,,
how can i lose fat slowly?,FALSE,,,,0.386685746352413,,,,
why do i lose weight so slowly?,FALSE,,,,0.386685746352413,,,,
how do i completely change my diet?,FALSE,,,,0.386685746352413,,,,
what is the best way to lose weight uk?,FALSE,,,,0.386685746352413,,,,
can you lose weight just through diet?,FALSE,,,,0.386685746352413,,,,
how can i slim down in 3 days?,FALSE,,,,0.386685746352413,,,,
how can i seriously lose weight fast?,FALSE,,,,0.386685746352413,,,,
what do you eat during the 7 day challenge?,FALSE,,,,0.386685746352413,,informational,54,2024-07-19
why can't i lose any more weight?,FALSE,,,,0.386685746352413,,,,
how can i get slim in 10 days workout?,FALSE,,,,0.386685746352413,,,,
how can i lose weight in winter without exercise?,FALSE,,,,0.386685746352413,,,,
how can i get a flat tummy naturally?,FALSE,,,,0.386685746352413,,,,
what is a reasonable amount of weight to lose per week?,FALSE,,,,0.386685746352413,,,,
how can i lose weight without pain?,FALSE,,,,0.386685746352413,,,,
can you lose weight without trying?,FALSE,,,,0.386685746352413,,,,
what to do if you really want to lose weight?,FALSE,,,,0.386685746352413,,,,
how can i gain weight in home?,FALSE,,,,0.386685746352413,,,,
how do i stay consistent with weight loss?,FALSE,,,,0.386685746352413,,informational,40,2024-07-21
what activities help you lose weight?,FALSE,,,,0.386685746352413,,informational,64,2023-11-15
can you lose weight without pills?,FALSE,,,,0.386685746352413,,,,
how can i get skinny without starving myself?,FALSE,,,,0.386685746352413,,,,
how can i lose 1kg in a week?,FALSE,,,,0.386685746352413,,informational,44,2024-07-19
can you lose 30 pounds in 6 weeks?,FALSE,,,,0.386685746352413,,,,
