Keyword,Tracked,Campaigns,Min Monthly Volume,Max Monthly Volume,Relevancy,Monthly Volume,Search Intent,Difficulty,Last Updated
how to lose weight fast,FALSE,,118001,300000,0.966955587896699,184000,informational,70,2024-08-12
weight loss,FALSE,,70801,118000,0.8601232805708555,100500,informational,75,2024-08-12
weight loss pills,FALSE,,30301,70800,0.8326436310227864,67500,informational,58,2024-08-10
how to lose weight,FALSE,,30301,70800,0.832854752359642,45848,informational,73,2024-08-12
weight loss calculator,FALSE,,30301,70800,0.8258565165041284,45250,informational,55,2024-08-06
lose weight fast,FALSE,,11501,30300,0.8190694019854703,24750,informational,69,2024-08-11
best weight loss diet,FALSE,,11501,30300,0.8311732000578891,20250,commercial,72,2024-08-11
best diet to lose weight,FALSE,,11501,30300,0.816993389061189,20250,commercial,72,2024-08-10
weight loss programs,FALSE,,11501,30300,0.9660807541017733,13734,commercial,67,2024-08-12
weight loss clinic,FALSE,,11501,30300,0.8258565165041284,13550,transactional,42,2024-08-06
best weight loss program,FALSE,,11501,30300,0.8234121735794357,13400,commercial,68,2024-07-31
diet plan,FALSE,,6501,9300,0.8144752691524368,9050,informational,73,2024-08-12
how to lose weight fast in 2 weeks,FALSE,,6501,9300,0.8298065365071491,7502,informational,62,2024-08-12
weight loss tips,FALSE,,4301,6500,0.8312527482681723,6234,informational,73,2024-08-12
weight loss shakes,FALSE,,4301,6500,0.8190694019854703,6050,commercial,35,2024-08-11
how to lose weight fast without exercise,FALSE,,4301,6500,0.8326436310227864,5983,informational,54,2024-08-09
how to lose weight in a week,FALSE,,4301,6500,0.9662180612120732,5018,informational,68,2024-08-12
how to lose weight without exercise,FALSE,,4301,6500,0.8258565165041284,4950,informational,51,2024-08-10
weight management,FALSE,,2901,4300,0.8040000614065238,4050,informational,69,2024-08-10
best diets for weight loss,FALSE,,2901,4300,0.8292503057928108,3635,commercial,72,2024-08-10
How to lose weight in 7 days,FALSE,,2901,4300,0.8096944074129002,3346,,,
Extreme weight loss methods,FALSE,,1701,2900,0.8096944074129002,2737,,,
free weight loss programs,FALSE,,1701,2900,0.8218272436820921,1779,commercial,64,2024-08-01
diet for weight loss,FALSE,,1701,2900,0.8117312488192522,1740,commercial,74,2024-07-08
lose weight naturally,FALSE,,851,1700,0.9408206838233732,1435,informational,68,2024-08-11
how to lose weight overnight,FALSE,,851,1700,0.8061526370071487,1262,informational,54,2024-07-08
how to lose weight naturally,FALSE,,851,1700,0.9857270551754261,1237,informational,70,2024-08-12
diet plan for weight loss,FALSE,,851,1700,0.8282198640950651,1202,commercial,70,2024-08-12
weight loss diet plan,FALSE,,851,1700,0.821431875085755,1200,informational,72,2024-08-12
fat burning diets,FALSE,,851,1700,0.821418649022711,1185,informational,70,2024-07-14
how to lose weight at home,FALSE,,851,1700,0.8292682164645873,966,informational,71,2024-08-12
lose fat fast,FALSE,,851,1700,0.8279853812311239,966,informational,70,2024-08-10
weight loss tips for women,FALSE,,851,1700,0.8224811019459292,966,informational,67,2024-08-04
healthy eating for weight loss,FALSE,,501,850,0.8207219961356839,641,informational,72,2024-07-18
fast weight loss tips,FALSE,,501,850,0.8119649176509192,510,informational,69,2024-07-18
how to actually lose weight,FALSE,,201,500,0.8306512572057517,500,informational,73,2024-08-12
how to lose weight in a day,FALSE,,201,500,0.8202790545210209,453,informational,63,2024-08-06
how to lose weight in 10 days,FALSE,,201,500,0.8258565165041284,444,informational,59,2024-08-01
healthy weight loss per month,FALSE,,201,500,0.9220752474852483,440,informational,67,2024-08-12
how to lose weight fast naturally,FALSE,,201,500,0.9856084824334981,369,informational,65,2024-08-12
how to slim down,FALSE,,201,500,0.8080146803294747,365,informational,72,2024-07-19
how to lose weight fast naturally and permanently,FALSE,,201,500,0.9392693948778063,358,informational,71,2024-08-12
How to lose weight fast naturally and permanently,FALSE,,201,500,0.8096944074129002,358,,,
science of weight loss,FALSE,,201,500,0.8074245364889666,299,informational,59,2023-08-26
weight loss that works,FALSE,,201,500,0.9473023958526203,295,informational,70,2024-08-12
how to start weight loss journey,FALSE,,201,500,0.9102591422178685,240,informational,52,2024-04-16
key to losing weight,FALSE,,201,500,0.8209850773812821,208,informational,69,2024-07-18
weight loss per week,FALSE,,201,500,0.8099894777040124,202,informational,70,2024-08-10
long term weight loss,FALSE,,101,200,0.8190159242627292,195,,,
desperate to lose weight,FALSE,,101,200,0.8190159242627292,195,informational,44,2024-07-18
how to lose weight fast naturally with home remedies,FALSE,,101,200,0.9283545329263612,163,informational,51,2024-08-12
lose weight by eating,FALSE,,101,200,0.8258565165041284,163,informational,67,2024-07-31
how to lose weight fast and easy,FALSE,,101,200,0.8254930888409899,163,informational,67,2024-08-12
how to lose weight naturally at home remedy,FALSE,,101,200,0.9352241110071002,160,informational,58,2024-08-12
how to start a weight loss journey,FALSE,,101,200,0.9786792192705077,132,informational,49,2024-04-16
weight loss facts,FALSE,,101,200,0.8183190830622786,132,informational,57,2024-07-18
weight loss articles,FALSE,,101,200,0.8183190830622786,132,informational,70,2024-07-14
fitness tips for weight loss,FALSE,,101,200,0.8089242849618509,132,informational,70,2024-08-01
how to lose weight consistently,FALSE,,101,200,0.9530252360148916,130,informational,70,2024-08-12
fat loss plan,FALSE,,101,200,0.8250772089679277,130,informational,71,2024-07-18
weight loss lifestyle,FALSE,,101,200,0.9585499714976335,125,informational,69,2024-08-12
7-day diet plan for weight loss,FALSE,,101,200,0.8096944074129002,124,informational,46,2024-08-08
tips for weight loss at home,FALSE,,51,100,0.8164759386015458,82,informational,68,2024-08-01
weight loss research,FALSE,,51,100,0.8160054263636906,74,informational,72,2024-08-06
where to start weight loss,FALSE,,51,100,1,73,,,
nutrition for fat loss,FALSE,,51,100,0.823773229839103,70,informational,72,2024-07-17
everything you need to know about losing weight,FALSE,,51,100,0.8136483989198858,64,informational,59,2024-08-10
how to lose weight fast without exercise in a month,FALSE,,11,50,0.8121251014285544,48,informational,56,2024-08-10
how to lose weight in 10 days at home without exercise,FALSE,,11,50,0.8295327000277154,47,informational,53,2024-08-12
how to lose weight in 2 weeks naturally,FALSE,,11,50,0.9283545329263612,38,informational,62,2024-08-12
natural weight loss tips,FALSE,,11,50,0.8227455855090574,36,informational,72,2024-08-12
how to reduce weight naturally,FALSE,,11,50,0.8136483989198858,35,informational,70,2024-08-12
how to start your weight loss journey,FALSE,,11,50,0.8974137107641241,31,informational,44,2024-04-16
how to lose weight every day,FALSE,,11,50,0.9647891532480922,26,informational,71,2024-08-10
weight management strategies,FALSE,,11,50,0.9457919956058134,25,informational,70,2024-08-12
Fastest way to lose weight for woman,FALSE,,11,50,0.8096944074129002,24,,,
how to lose weight for real,FALSE,,11,50,0.8164071545099627,21,informational,70,2024-07-31
how to slim down naturally,FALSE,,11,50,0.8136483989198858,17,informational,69,2024-08-08
how to lose weight naturally in 2 weeks,FALSE,,11,50,0.9352241110071002,16,informational,62,2024-08-11
weight loss facts and tips,FALSE,,11,50,0.8131218837592998,11,informational,67,2024-08-12
how to lose weight in 14 days without exercise,FALSE,,,10,0.8136483989198858,6,informational,58,2024-08-08
easy weight loss tips for beginners,FALSE,,,10,0.9599397157280424,5,informational,55,2024-07-26
how to lose weight stupidly fast,FALSE,,,10,0.8367908380448177,5,informational,58,2024-08-12
get skinny in 4 days,FALSE,,,10,0.8227455855090574,5,informational,56,2024-07-11
lose weight slowly but surely,FALSE,,,10,0.8136483989198858,5,informational,54,2024-08-12
100 weight loss tips that really work,FALSE,,,10,0.8136483989198858,5,informational,54,2024-07-18
exercise to lose weight fast at home in 10 days,FALSE,,,10,0.8136483989198858,5,informational,60,2024-07-29
How to start weight loss journey at home,FALSE,,,10,0.8096944074129002,4,,,
losing weight getting started,FALSE,,,10,0.951791180137097,3,informational,62,2024-07-11
how does weight loss work scientifically,FALSE,,,10,0.8367908380448177,1,informational,64,2024-08-08
how to lose weight in 5 days without exercise,FALSE,,,10,0.8295327000277154,1,informational,58,2024-08-08
fast weight loss strategies,FALSE,,,10,0.8295327000277154,1,informational,72,2024-07-18
losing weight permanently secrets of the 2 who succeed,FALSE,,,10,0.8295327000277154,1,informational,44,2024-08-12
permanent weight loss the natural way,FALSE,,,10,0.8295327000277154,1,informational,59,2024-08-12
how to lose weight in two days without exercise,FALSE,,,10,0.8136483989198858,1,informational,60,2024-08-02
crazy ways to lose weight,FALSE,,,10,0.8136483989198858,1,informational,47,2024-07-18
how to lose weight super fast in 2 weeks,FALSE,,,10,0.8136483989198858,1,informational,44,2024-08-08
how to lose weight in 4 weeks fast at home,FALSE,,,,0.8295327000277154,,informational,63,2024-08-08
how to reduce weight 10kg in 7 days with exercise,FALSE,,,,0.8136483989198858,,informational,55,2024-08-08
how to lose weight in 5 days home remedies,FALSE,,,,0.8136483989198858,,informational,55,2024-08-01
Where to start weight loss fast,FALSE,,,,0.8096944074129002,,,,
Where to start weight loss reddit,FALSE,,,,0.8096944074129002,,,,
best diet for weight loss,FALSE,,11501,30300,0.6249778628099791,20250,informational,73,2024-08-10
diet to lose weight,FALSE,,11501,30300,0.6750751669633449,13550,informational,74,2024-07-18
mayo clinic diet,FALSE,,9301,11500,0.6052455703143181,10975,informational,66,2024-05-29
how to lose fat,FALSE,,4301,6500,0.669586982293086,6234,informational,73,2024-08-12
how to get skinny,FALSE,,4301,6500,0.668895790198912,5018,informational,56,2024-08-12
weight loss plan,FALSE,,2901,4300,0.675399031763688,4106,informational,72,2024-08-06
best weight loss programs,FALSE,,1701,2900,0.7208713669018902,2757,commercial,70,2024-08-10
lose weight in 2 weeks,FALSE,,1701,2900,0.7541079473560455,2200,informational,57,2024-07-14
extreme weight loss,FALSE,,1701,2900,0.6030039983164983,2200,informational,67,2024-08-06
healthy weight loss,FALSE,,1701,2900,0.6231015150197375,2176,informational,73,2024-08-10
fat loss diet,FALSE,,1701,2900,0.6487234044640562,1825,informational,76,2024-08-10
healthy weight loss per week,FALSE,,851,1700,0.6027261424120001,1237,informational,75,2024-08-10
lose weight diet,FALSE,,851,1700,0.7572254543842714,1032,informational,75,2024-08-11
fast fat loss,FALSE,,851,1700,0.7767925354215439,966,informational,67,2024-08-10
weight loss diet plan for men,FALSE,,501,850,0.667267189885157,810,commercial,57,2024-08-12
lose weight in a week,FALSE,,501,850,0.7477920102477617,791,informational,69,2024-08-11
how to lose weight quick,FALSE,,501,850,0.751242396774409,572,informational,68,2024-08-12
successful weight loss,FALSE,,201,500,0.6701107729073464,500,informational,72,2024-07-18
how to reduce weight,FALSE,,201,500,0.7260756153540031,472,informational,72,2024-08-12
how to lose weight in 30 days at home,FALSE,,201,500,0.7245122596226783,457,informational,60,2024-08-06
lose weight in 3 days,FALSE,,201,500,0.751242396774409,444,informational,64,2024-03-13
most effective weight loss diet,FALSE,,201,500,0.6913657301806233,444,commercial,72,2024-07-31
weight loss tricks,FALSE,,201,500,0.6697202991824582,440,informational,66,2024-07-16
how to reduce body fat naturally,FALSE,,201,500,0.669001029744863,395,informational,66,2024-08-12
safe weight loss rate,FALSE,,201,500,0.7594459879734193,360,informational,72,2024-08-10
quickest way to lose fat,FALSE,,201,500,0.6890665537707812,357,informational,70,2024-08-10
weight loss secrets,FALSE,,201,500,0.7784041078355773,304,informational,72,2024-07-14
weight loss naturally,FALSE,,201,500,0.6333737650029775,287,informational,68,2024-07-13
weight loss easy,FALSE,,201,500,0.6313688353084483,252,informational,73,2024-06-30
how to lose weight in 2 weeks with exercise,FALSE,,201,500,0.6296675000957066,240,informational,61,2024-08-06
serious weight loss,FALSE,,101,200,0.6308454041413121,195,informational,67,2024-07-16
how to lose weight fast at home,FALSE,,101,200,0.7496493710946521,179,informational,69,2024-07-19
lose weight fast naturally,FALSE,,101,200,0.6287383101089011,174,informational,65,2024-08-12
lose weight now,FALSE,,101,200,0.7179729831462894,163,,,
effective weight loss programs,FALSE,,101,200,0.6295619150099712,163,commercial,72,2024-07-30
how to lose weight fast without exercise or diet or pills,FALSE,,101,200,0.7830487077482853,122,informational,59,2024-08-10
how to really lose weight,FALSE,,101,200,0.7621779612564618,104,informational,73,2024-07-18
losing weight naturally,FALSE,,101,200,0.6257689860301499,102,informational,67,2024-07-13
tricks to losing weight,FALSE,,51,100,0.7319231137518093,92,informational,66,2024-07-23
lose weight in 3 days with water,FALSE,,51,100,0.6296675000957066,92,,,
ways to lose weight naturally,FALSE,,51,100,0.6248632903213602,92,informational,68,2024-07-13
how to lose weight in 3 days with exercise,FALSE,,51,100,0.6296675000957066,73,informational,61,2024-07-19
scientific weight loss program,FALSE,,51,100,0.789024782335944,64,informational,76,2024-08-07
how to create a weight loss plan,FALSE,,51,100,0.7245122596226783,64,informational,47,2024-08-06
how to lose weight without eating,FALSE,,51,100,0.7937335183470663,57,,,
weight loss basics,FALSE,,51,100,0.6050383102598781,56,,,
how to lose weight all over,FALSE,,51,100,0.7518956745587494,55,informational,73,2024-07-13
best diet for fat loss female,FALSE,,51,100,0.6048477264555644,55,,,
how to lose weight naturally without exercise,FALSE,,11,50,0.6806777547247423,48,informational,47,2024-08-10
how to lose weight through diet only,FALSE,,11,50,0.7882497408262651,45,informational,58,2024-07-19
proper nutrition for weight loss,FALSE,,11,50,0.6398097910691652,45,informational,69,2024-08-06
how to lose weight in a week at home,FALSE,,11,50,0.6296675000957066,38,informational,58,2024-08-06
rapid weight loss tips,FALSE,,11,50,0.7455441053575926,35,informational,67,2023-07-09
how to reduce obesity naturally,FALSE,,11,50,0.669001029744863,31,informational,69,2024-08-06
who lose weight off of core meal,FALSE,,11,50,0.6782706638099164,27,informational,62,2024-07-18
how to control weight naturally,FALSE,,11,50,0.6030039983164983,27,informational,71,2024-08-12
how to start losing weight fast,FALSE,,11,50,0.7799849177901935,25,informational,68,2024-07-18
weight loss with,FALSE,,11,50,0.6399288019785617,25,informational,77,2024-04-26
how to lose weight in 2 days naturally,FALSE,,11,50,0.7890247823359446,24,informational,65,2024-07-31
natural weight loss diet,FALSE,,11,50,0.6237872968811177,21,,,
desperate to lose weight fast,FALSE,,11,50,0.6233349582458028,20,informational,52,2024-07-17
how to lose weight fast without exercise in a week,FALSE,,11,50,0.6296675000957066,13,informational,56,2024-08-10
how to lose weight in 5 days naturally,FALSE,,,10,0.7890247823359446,11,informational,71,2024-07-31
drastic weight loss methods,FALSE,,11,50,0.789024782335944,11,informational,57,2024-08-07
helpful weight loss tips,FALSE,,,10,0.6288362779807735,11,informational,68,2024-03-01
little ways to lose weight,FALSE,,,10,0.7245122596226783,10,informational,60,2024-07-25
natural ways to lose weight fast at home,FALSE,,,10,0.7245122596226783,10,informational,64,2024-08-12
steps to lose weight with exercise,FALSE,,,10,0.7245122596226783,5,informational,67,2024-08-06
extreme weight loss cancelled,FALSE,,,10,0.6030039983164983,5,informational,49,2024-07-17
things to know about losing weight,FALSE,,,10,0.7890247823359446,2,informational,59,2024-07-18
remedies to lose weight fast naturally,FALSE,,,10,0.7245122596226783,2,informational,62,2024-07-31
natural diet for weight loss,FALSE,,,10,0.669001029744863,1,informational,72,2024-08-01
weight loss strategies that work,FALSE,,,10,0.6690010297448628,1,informational,68,2024-07-13
natural remedies to lose weight quickly,FALSE,,,,0.7245122596226783,,informational,63,2024-08-01
natural way to lose weight fast at home,FALSE,,,,0.7245122596226783,,informational,63,2024-08-12
best natural way to lose weight quickly,FALSE,,,,0.7245122596226783,,informational,70,2024-07-18
foods lose weight fast naturally,FALSE,,,,0.669001029744863,,informational,67,2024-07-18
how to lose weight fast naturally for free,FALSE,,,,0.669001029744863,,informational,68,2024-08-12
how to fight obesity naturally,FALSE,,,,0.669001029744863,,informational,68,2024-08-06
healthy diet,FALSE,,9301,11500,0.45173079615808054,10975,informational,74,2024-08-12
weight loss programs near me,FALSE,,1701,2900,0.4941208870222576,2737,transactional,48,2024-07-31
how to lose 2 pounds a week,FALSE,,1701,2900,0.5993339572927597,1856,informational,48,2024-08-06
what exercise burns the most belly fat?,FALSE,,851,1700,0.4495369891274706,907,informational,57,2024-08-12
why do i keep losing weight for no reason?,FALSE,,501,850,0.44039612649992893,691,informational,62,2024-08-06
weight loss jump start,FALSE,,501,850,0.43518572848719156,519,,,
what is the safest form of weight loss surgery?,FALSE,,201,500,0.44039612649992893,483,informational,38,2024-07-14
extreme makeover weightloss edition,FALSE,,201,500,0.5675004910213243,445,informational,65,2024-08-07
what foods help burn belly fat?,FALSE,,201,500,0.4495369891274706,395,informational,66,2024-08-12
how to lose weight fast for kids,FALSE,,201,500,0.5584140405339542,371,informational,58,2024-07-18
how can i reduce my stomach fat?,FALSE,,201,500,0.44039612649992893,358,informational,69,2024-07-05
best ways to lose weight quickly,FALSE,,201,500,0.5671474833765552,357,informational,71,2024-06-30
is it realistic to lose 10 pounds in a month?,FALSE,,201,500,0.4495369891274706,346,informational,45,2024-08-12
weight loss nutritionist,FALSE,,201,500,0.5755332075212536,310,informational,35,2024-08-06
how to lose weight fast for men,FALSE,,201,500,0.5733803406139517,308,informational,58,2024-08-12
weight management program,FALSE,,201,500,0.5754195510645046,299,,,
how do you lose 10 pounds in a week?,FALSE,,201,500,0.4495369891274706,287,informational,61,2024-08-12
how much weight can you lose with intermittent fasting?,FALSE,,201,500,0.44039612649992893,252,informational,58,2024-06-26
how to lose weight quickly and safely,FALSE,,201,500,0.5236615877864849,214,informational,72,2024-08-05
lose weight by eating more,FALSE,,101,200,0.49876839255221905,196,,,
how to lose weight overnight fast,FALSE,,101,200,0.5584140405339542,185,informational,55,2024-07-19
can you lose 20 pounds in a month?,FALSE,,101,200,0.4495369891274706,174,,,
how can i lose 10 pounds in 7 days?,FALSE,,101,200,0.4495369891274706,163,informational,63,2024-08-12
what foods to eat to lose belly fat?,FALSE,,101,200,0.44039612649992893,163,informational,68,2024-07-31
weight loss programs free,FALSE,,101,200,0.4981066438026088,153,"informational,commercial",62,2024-07-31
what can doctors prescribe for weight loss?,FALSE,,101,200,0.4495369891274706,142,informational,63,2024-08-12
how do i lose 10 pounds in a week?,FALSE,,101,200,0.4495369891274706,132,informational,62,2024-07-31
what are the top 10 diet plans?,FALSE,,101,200,0.44039612649992893,132,commercial,66,2024-07-30
how can i lose weight fast in 3 days?,FALSE,,101,200,0.4495369891274706,122,informational,69,2024-08-02
what is the best weight loss pill?,FALSE,,101,200,0.44039612649992893,122,informational,57,2024-08-06
how to lose weight fast naturally without pills and exercise,FALSE,,101,200,0.5236615877864849,111,informational,58,2024-07-08
quick start weight loss,FALSE,,101,200,0.43406961544464717,104,,,
can you lose 10 pounds in a week?,FALSE,,101,200,0.4495369891274706,102,informational,59,2024-07-19
how can i lose weight fast?,FALSE,,51,100,0.4495369891274706,92,informational,69,2024-07-26
extreme makeover weight loss edition,FALSE,,51,100,0.5504435777528369,90,informational,65,2024-08-01
how to lose weight in 10 days diet plan,FALSE,,51,100,0.5733803406139517,82,informational,57,2024-07-08
starting weight loss journey,FALSE,,51,100,0.4658043983430341,82,,,
how much weight can you lose in a month?,FALSE,,51,100,0.4495369891274706,82,informational,51,2024-07-11
how to lose weight in 3 days at home,FALSE,,51,100,0.5584140405339542,73,informational,69,2024-07-19
how much weight do you have to lose before you notice?,FALSE,,51,100,0.44039612649992893,73,,,
how do you get a flat stomach overnight?,FALSE,,51,100,0.44039612649992893,73,informational,54,2024-08-01
weight loss experts,FALSE,,51,100,0.569308408529059,65,,,
start weight loss journey,FALSE,,51,100,0.4658043983430341,64,,,
how can i lose fat quickly?,FALSE,,51,100,0.4495369891274706,64,informational,71,2024-07-17
what illnesses can cause extreme weight loss?,FALSE,,51,100,0.44039612649992893,64,,,
how many steps should you take a day to lose 2 pounds a week?,FALSE,,51,100,0.44039612649992893,64,informational,56,2024-07-05
cdc weight loss,FALSE,,51,100,0.5692295533402533,59,,,
weight issues,FALSE,,51,100,0.568234898535754,57,,,
how to lose weight healthfully,FALSE,,51,100,0.5957245469039609,55,informational,68,2024-07-23
weight loss information,FALSE,,51,100,0.5684355875894631,55,informational,65,2024-08-12
how to lose weight in a week naturally,FALSE,,51,100,0.4941208870222576,55,informational,68,2024-07-08
how can i drop 10 pounds in a week?,FALSE,,51,100,0.4495369891274706,55,informational,64,2024-08-12
how can you lose 10 pounds in a week?,FALSE,,51,100,0.4495369891274706,55,informational,62,2024-08-03
how much weight can you lose in a week?,FALSE,,51,100,0.44039612649992893,55,,,
can you lose 5 pounds in a week?,FALSE,,51,100,0.44039612649992893,55,,,
is fasting a good way to lose weight?,FALSE,,51,100,0.44039612649992893,55,informational,65,2024-05-03
extreme weight loss rachel,FALSE,,11,50,0.5675004910213243,47,informational,62,2024-08-10
how can i lose weight fast in 2 weeks?,FALSE,,11,50,0.4495369891274706,47,informational,57,2024-07-17
how can i get a flat stomach in 2 days?,FALSE,,11,50,0.4495369891274706,47,informational,56,2024-07-17
what fruit burns the most fat?,FALSE,,11,50,0.44039612649992893,47,,,
healthy weight loss per week kg,FALSE,,11,50,0.5686265896995063,46,informational,54,2024-06-04
weight management articles,FALSE,,11,50,0.5673151391099993,45,informational,71,2024-08-03
how much weight can you lose on a 3 day fast?,FALSE,,11,50,0.44039612649992893,42,informational,47,2024-08-12
weight loss method,FALSE,,11,50,0.5729082250182067,39,informational,75,2024-07-14
crazy weight loss diet,FALSE,,11,50,0.5504435777528369,39,informational,59,2024-08-06
how much weight can i lose in a week?,FALSE,,11,50,0.4495369891274706,39,informational,61,2024-07-20
how does the fat leave your body?,FALSE,,11,50,0.4495369891274706,39,informational,58,2023-10-24
weight management plan,FALSE,,11,50,0.5725840457483867,35,informational,66,2024-08-03
how do you lose weight fast honestly?,FALSE,,11,50,0.44039612649992893,33,,,
lose weight now sharon pa,FALSE,,11,50,0.5236615877864849,31,transactional,28,2024-08-06
which diet is best for weight loss?,FALSE,,11,50,0.4495369891274706,31,commercial,70,2024-08-10
what is considered rapid weight loss?,FALSE,,11,50,0.44039612649992893,31,informational,63,2024-07-17
how can i lose tummy fat fast?,FALSE,,11,50,0.44039612649992893,31,informational,69,2024-06-27
what supplements are best for weight loss?,FALSE,,11,50,0.44039612649992893,31,informational,55,2024-08-12
real weight loss tips,FALSE,,11,50,0.5705866894666628,28,,,
how to lose weight in 3 days naturally,FALSE,,11,50,0.4941208870222576,27,informational,68,2024-07-08
weight loss starter,FALSE,,11,50,0.46644566654196284,27,,,
how to start a weight loss journey blog,FALSE,,11,50,0.46578137262093217,27,informational,31,2024-04-16
how long does it take for you to notice weight loss?,FALSE,,11,50,0.4495369891274706,27,informational,37,2024-07-30
what is the best exercise to lose weight fast?,FALSE,,11,50,0.4495369891274706,27,informational,60,2024-08-04
what herbs help burn belly fat?,FALSE,,11,50,0.4495369891274706,27,informational,55,2024-08-01
can you lose 7 pounds in 3 days?,FALSE,,11,50,0.44039612649992893,27,,,
how can i reduce my tummy naturally?,FALSE,,11,50,0.44039612649992893,27,,,
how does fat leave your body when you lose weight?,FALSE,,11,50,0.44039612649992893,27,informational,53,2024-07-17
how much weight can you lose by fasting for a week?,FALSE,,11,50,0.44039612649992893,27,,,
starting a weight loss program,FALSE,,11,50,0.42565568047308594,25,,,
weight management tips,FALSE,,11,50,0.5709842466349812,24,informational,71,2024-08-03
extreme weight loss diets for men,FALSE,,11,50,0.5675004910213243,24,informational,59,2024-08-10
extreme weight loss tactics,FALSE,,11,50,0.5675004910213243,24,informational,64,2024-07-18
how to start a weight loss journey instagram,FALSE,,11,50,0.46576010406329466,24,informational,51,2024-04-16
what is the most successful weight loss program?,FALSE,,11,50,0.4495369891274706,24,commercial,68,2024-07-31
how can i lose 20 pounds in a month without exercise?,FALSE,,11,50,0.4495369891274706,24,informational,61,2024-04-16
what can i drink to lose weight fast?,FALSE,,11,50,0.4495369891274706,24,informational,59,2024-08-01
what are the side effects of losing weight too fast?,FALSE,,11,50,0.44039612649992893,24,informational,54,2024-07-17
is it possible to lose 10 pounds in a day?,FALSE,,11,50,0.44039612649992893,24,,,
how can i boost my metabolism after 50?,FALSE,,11,50,0.44039612649992893,24,informational,44,2024-07-11
what is the best workout for weight loss?,FALSE,,11,50,0.44039612649992893,24,informational,60,2024-07-17
