Keyword,Tracked,Campaigns,Min Monthly Volume,Max Monthly Volume,Relevancy,Monthly Volume,Search Intent,Difficulty,Last Updated
how much fat can you lose in 7 weeks?,FALSE,,,,0.386685746352413,,,,
how do you get skinny really fast?,FALSE,,,,0.386685746352413,,,,
how weight is gained?,FALSE,,,,0.386685746352413,,,,
can you lose weight in 8 weeks?,FALSE,,,,0.386685746352413,,,,
how can i lose weight in 8 days?,FALSE,,,,0.386685746352413,,,,
how can i lose 8 pounds fast?,FALSE,,,,0.386685746352413,,,,
can you lose 3 pounds in 3 days?,FALSE,,,,0.386685746352413,,,,
how can i lose 3 pounds in 4 days?,FALSE,,,,0.386685746352413,,,,
can you safely lose 3 pounds a week?,FALSE,,,,0.386685746352413,,,,
can i lose 5 pounds in 4 days?,FALSE,,,,0.386685746352413,,,,
how do you gain weight after losing too much?,FALSE,,,,0.386685746352413,,,,
why am i gaining weight eating healthy?,FALSE,,,,0.386685746352413,,,,
how many pounds can you lose if you don't eat?,FALSE,,,,0.386685746352413,,,,
how can i lose 14 pounds fast?,FALSE,,,,0.386685746352413,,,,
can i lose 14 pounds in a month?,FALSE,,,,0.386685746352413,,,,
how can i temporarily lose weight fast?,FALSE,,,,0.386685746352413,,,,
how can i lose weight fast uk?,FALSE,,,,0.386685746352413,,,,
how do you realistically lose weight?,FALSE,,,,0.386685746352413,,informational,71,2023-11-15
how can i lose major weight fast?,FALSE,,,,0.386685746352413,,,,
can you lose weight just by eating healthier?,FALSE,,,,0.386685746352413,,informational,61,2024-07-05
how can i lose weight in a short time?,FALSE,,,,0.386685746352413,,,,
is 10000 steps enough to lose weight?,FALSE,,,,0.386685746352413,,,,
how long will it take to lose 8 lbs?,FALSE,,,,0.386685746352413,,,,
how do i lose 1 pound a month?,FALSE,,,,0.386685746352413,,,,
how much can you lose in 4 days?,FALSE,,,,0.386685746352413,,,,
can you lose weight by not eating at all?,FALSE,,,,0.386685746352413,,,,
how do i detox before vacation?,FALSE,,,,0.386685746352413,,,,
what should i eat the week before my vacation?,FALSE,,,,0.386685746352413,,,,
what things can help you lose weight?,FALSE,,,,0.386685746352413,,,,
how can i lose 40 pounds quickly?,FALSE,,,,0.386685746352413,,informational,43,2024-04-16
how can i lose 5 pounds in 4 days?,FALSE,,,,0.386685746352413,,,,
how do i lose 15 pounds in a week?,FALSE,,,,0.386685746352413,,,,
what should i eat to lose 5kg in a week?,FALSE,,,,0.386685746352413,,,,
how can i lose weight and look slimmer?,FALSE,,,,0.386685746352413,,,,
is it harder to lose weight when you have less to lose?,FALSE,,,,0.386685746352413,,,,
how can i lose 15 pounds in 4 weeks?,FALSE,,,,0.386685746352413,,,,
what diet helps lose weight fast?,FALSE,,,,0.386685746352413,,,,
how can i lose 6 pounds in a week naturally?,FALSE,,,,0.386685746352413,,,,
how long does it take to lose 6 lbs?,FALSE,,,,0.386685746352413,,,,
how can i lose 5 kilos in 4 weeks?,FALSE,,,,0.386685746352413,,,,
what is the best way for a man to lose weight?,FALSE,,,,0.386685746352413,,,,
how do you lose a bit of weight?,FALSE,,,,0.386685746352413,,,,
how can i lose a little weight?,FALSE,,,,0.386685746352413,,,,
is it possible to lose weight overnight?,FALSE,,,,0.386685746352413,,,,
can you lose 8 pounds in 3 days?,FALSE,,,,0.386685746352413,,,,
how can i get skinny in 4 days?,FALSE,,,,0.386685746352413,,,,
can you lose 10 pounds in 4 days?,FALSE,,,,0.386685746352413,,,,
can you lose 4 pounds in 4 days?,FALSE,,,,0.386685746352413,,,,
how long will it take to lose 15 pounds?,FALSE,,,,0.386685746352413,,,,
can you do the military diet for 6 days?,FALSE,,,,0.386685746352413,,,,
how much weight can i expect to lose in a week?,FALSE,,,,0.386685746352413,,,,
when can i expect to see weight loss results?,FALSE,,,,0.386685746352413,,,,
how much water weight do you lose before you start losing fat?,FALSE,,,,0.386685746352413,,,,
what is the easiest diet to maintain?,FALSE,,,,0.386685746352413,,commercial,65,2023-11-16
how quickly can you lose 100 pounds?,FALSE,,,,0.386685746352413,,informational,50,2024-04-16
how can i lose 100 pounds successfully?,FALSE,,,,0.386685746352413,,,,
can losing 10 pounds lower blood pressure?,FALSE,,,,0.386685746352413,,,,
what do you eat on a low carb diet to lose weight?,FALSE,,,,0.386685746352413,,informational,68,2024-06-22
what is the best method to losing weight?,FALSE,,,,0.386685746352413,,,,
how do i get skinny without exercise?,FALSE,,,,0.386685746352413,,,,
can not eating for a day help you lose weight?,FALSE,,,,0.386685746352413,,,,
can changing your eating habits make you lose weight?,FALSE,,,,0.386685746352413,,,,
how can i lose weight without food sacrifice?,FALSE,,,,0.386685746352413,,,,
can changing eating habits help you lose weight?,FALSE,,,,0.386685746352413,,,,
how long does it take to lose 6 pounds?,FALSE,,,,0.386685746352413,,,,
is it safe to lose 6 pounds a week?,FALSE,,,,0.386685746352413,,,,
what exercises can i do to lose 10 pounds in 2 weeks?,FALSE,,,,0.386685746352413,,,,
how can i lose weight in 2 weeks without exercise and dieting?,FALSE,,,,0.386685746352413,,,,
how long should it take to lose 8 pounds?,FALSE,,,,0.386685746352413,,,,
is it safe to lose 8 pounds a month?,FALSE,,,,0.386685746352413,,,,
will eating clean help me lose weight?,FALSE,,,,0.386685746352413,,,,
can i lose 15 pounds in 3 weeks?,FALSE,,,,0.386685746352413,,,,
what should i look for when losing weight?,FALSE,,,,0.386685746352413,,,,
how can i drastically lose weight in 3 days?,FALSE,,,,0.386685746352413,,,,
can you lose weight in 2 days?,FALSE,,,,0.386685746352413,,,,
how can i change my lifestyle to lose weight?,FALSE,,,,0.386685746352413,,,,
is it bad to lose 7 pounds in a week?,FALSE,,,,0.386685746352413,,,,
how can i lose 7 pounds in a week?,FALSE,,,,0.386685746352413,,,,
can i lose a pound in 3 days?,FALSE,,,,0.386685746352413,,,,
can you still lose weight without eating healthy?,FALSE,,,,0.386685746352413,,,,
can you lose weight without diet?,FALSE,,,,0.386685746352413,,,,
how can i get slim in 7 days without exercise?,FALSE,,,,0.386685746352413,,,,
can we lose fat without dieting?,FALSE,,,,0.386685746352413,,,,
which food lose weight fast?,FALSE,,,,0.386685746352413,,informational,64,2024-06-29
how much weight can u lose in 10 days?,FALSE,,,,0.386685746352413,,,,
what foods help you slim down?,FALSE,,,,0.386685746352413,,informational,63,2024-07-05
can you still lose weight without running?,FALSE,,,,0.386685746352413,,,,
can i lose weight without dieting?,FALSE,,,,0.386685746352413,,,,
how can i lose weight before i go on vacation?,FALSE,,,,0.386685746352413,,,,
can you lose weight in 4 days?,FALSE,,,,0.386685746352413,,,,
can doctors help you lose weight?,FALSE,,,,0.386685746352413,,,,
how do doctors lose weight by advice?,FALSE,,,,0.386685746352413,,informational,51,2024-07-17
how do you get a flat stomach in minutes?,FALSE,,,,0.386685746352413,,,,
can you lose 10lbs in 4 days?,FALSE,,,,0.386685746352413,,,,
how much weight can i lose in a week on keto?,FALSE,,,,0.386685746352413,,,,
can i safely lose 3 lbs a week?,FALSE,,,,0.386685746352413,,,,
how can i lose 1 pound a week?,FALSE,,,,0.386685746352413,,,,
what is the best exercise to lose weight fast at home?,FALSE,,,,0.386685746352413,,commercial,59,2024-07-31
what exercises should a woman do to lose weight?,FALSE,,,,0.386685746352413,,informational,53,2024-08-09
can i lose 5 pounds a week?,FALSE,,,,0.386685746352413,,,,
can you lose weight by not eating and only drinking water?,FALSE,,,,0.386685746352413,,,,
is it possible to lose 10 pounds in 10 days?,FALSE,,,,0.386685746352413,,,,
can u lose weight by not eating?,FALSE,,,,0.386685746352413,,,,